{
  "canonical_unit_ids": [],
  "capability_id": "capability:qa-finding-triage",
  "completion_evidence": [
    "Source-derived atoms and provider or framework variants are cited; required checks and authorization evidence are recorded."
  ],
  "decision_references": [
    "V2-DEC-001",
    "V2-DEC-006"
  ],
  "fusion_decision_ids": [
    "V2-FUSION-0483",
    "V2-FUSION-0805",
    "V2-FUSION-0858",
    "V2-FUSION-0862"
  ],
  "hard_gates": [
    "Fail closed on missing authority, credentials, source evidence, required data governance, or verification."
  ],
  "inputs": [
    "QA findings, evidence, affected surface, release context, and severity policy."
  ],
  "lifecycle_stage_id": "stage:08-verification-quality",
  "name": "Qa Finding Triage",
  "non_responsibility": "Does not absorb unrelated lifecycle responsibilities or expand provider, workspace, or remote-write authority implicitly.",
  "outputs": [
    "Deduplicated finding set, severity, reproduction confidence, ownership, and repair handoff."
  ],
  "owning_phase": 6,
  "permission_identity": "read-only",
  "primary_domain_id": "domain:testing-and-quality-assurance",
  "provider_or_framework_variants": [],
  "responsibility": "Triage independently observed QA findings by reproducibility, severity, scope, ownership, and repair readiness without editing source.",
  "retained_auxiliary_unit_ids": [],
  "root_derived_atom_ids": [
    "v2-root:gstack/design-review:023:phase-7-triage",
    "v2-root:gstack/qa:012:phase-7-triage",
    "v2-root:gstack/review:018:step-5-fix-first-review",
    "v2-root:gstack/review:022:step-5c-batch-ask-about-ask-items"
  ],
  "schema_version": "2.0",
  "source_cluster_ids": [],
  "source_defect_refs": [],
  "source_evidence": [
    "gstack/design-review/SKILL.md:1545-1556",
    "gstack/qa/SKILL.md:710-735",
    "gstack/review/SKILL.md:766-805",
    "gstack/review/SKILL.md:823-847"
  ],
  "source_fragment_ids": [],
  "status": "candidate-taxonomy",
  "stop_conditions": [
    "Stop before destructive, external-write, merge, deploy, or production action without current explicit authorization."
  ]
}
