{
  "canonical_unit_ids": [],
  "capability_id": "capability:data-and-api-contract-design",
  "completion_evidence": [
    "Source-derived atoms and provider or framework variants are cited; required checks and authorization evidence are recorded."
  ],
  "decision_references": [
    "V2-DEC-001",
    "V2-DEC-006"
  ],
  "fusion_decision_ids": [
    "V2-FUSION-0951"
  ],
  "hard_gates": [
    "Fail closed on missing authority, credentials, source evidence, required data governance, or verification."
  ],
  "inputs": [
    "Approved requirements, domain entities, existing persistence and interfaces, consistency needs, and compatibility constraints."
  ],
  "lifecycle_stage_id": "stage:06-architecture-risk-security",
  "name": "Data And Api Contract Design",
  "non_responsibility": "Does not absorb unrelated lifecycle responsibilities or expand provider, workspace, or remote-write authority implicitly.",
  "outputs": [
    "Reviewable data model and migration contract plus API/interface schemas, errors, versioning, and validation plan."
  ],
  "owning_phase": 5,
  "permission_identity": "workspace-write",
  "primary_domain_id": "domain:architecture-data-api-and-security",
  "provider_or_framework_variants": [],
  "responsibility": "Define concrete data schemas, migrations, invariants, API interfaces, request/response shapes, versioning, and compatibility before implementation.",
  "retained_auxiliary_unit_ids": [],
  "root_derived_atom_ids": [
    "v2-root:gstack/spec:014:8-schema-api-shapes-and-data-models"
  ],
  "schema_version": "2.0",
  "source_cluster_ids": [],
  "source_defect_refs": [],
  "source_evidence": [
    "gstack/spec/SKILL.md:714-718"
  ],
  "source_fragment_ids": [],
  "status": "candidate-taxonomy",
  "stop_conditions": [
    "Stop before destructive, external-write, merge, deploy, or production action without current explicit authorization."
  ]
}
