{
  "canonical_unit_ids": [
    "craft-experiment-readout:unit-001",
    "craft-experiment-readout:unit-002",
    "craft-experiment-readout:unit-003",
    "craft-experiment-readout:unit-004",
    "craft-experiment-readout:unit-005",
    "craft-experiment-readout:unit-006",
    "craft-experiment-readout:unit-007",
    "discovery-process:unit-032",
    "discovery-process:unit-035",
    "discovery-process:unit-036",
    "discovery-process:unit-051",
    "discovery-process:unit-054",
    "discovery-process:unit-055",
    "discovery-process:unit-056"
  ],
  "capability_id": "capability:results-analysis-and-decision-readout",
  "completion_evidence": [
    "All declared outputs exist and their source citations, hashes, or executable checks are recorded."
  ],
  "decision_references": [
    "V2-DEC-001",
    "V2-DEC-003",
    "V2-DEC-005",
    "V2-DEC-006"
  ],
  "fusion_decision_ids": [
    "V2-FUSION-0069"
  ],
  "hard_gates": [
    "Interpret results against preset criteria and communicate evidence, limits, disagreements, and recommendations.",
    "Accept only: Experiment or research data, metrics, baselines, bias checks, and decision criteria.",
    "Produce only: An analysis, go/pivot/kill recommendation, stakeholder readout, limitations, and next steps.",
    "Preserve explicit source variants and gaps; never upgrade a missing dimension or source preference into a universal rule.",
    "Produce evidence-backed recommendations and unknowns; GO, PIVOT, KILL, prioritization adoption, roadmap commitment, and build approval remain human decisions."
  ],
  "inputs": [
    "Experiment or research data, metrics, baselines, bias checks, and decision criteria."
  ],
  "lifecycle_stage_id": "stage:03-strategy-prioritization",
  "name": "Results Analysis And Decision Readout",
  "non_responsibility": "Does not approve upstream product decisions, expand authority, or perform remote writes beyond its explicit permission identity.",
  "outputs": [
    "An analysis, go/pivot/kill recommendation, stakeholder readout, limitations, and next steps."
  ],
  "owning_phase": 3,
  "permission_identity": "workspace-write",
  "primary_domain_id": "domain:product-discovery-and-strategy",
  "provider_or_framework_variants": [],
  "responsibility": "Interpret results against preset criteria and communicate evidence, limits, disagreements, and recommendations.",
  "retained_auxiliary_unit_ids": [],
  "root_derived_atom_ids": [],
  "schema_version": "2.0",
  "source_cluster_ids": [
    "cluster:results-analysis-and-decision-readout"
  ],
  "source_defect_refs": [],
  "source_evidence": [
    "craft-experiment-readout/SKILL.md:30-39",
    "craft-experiment-readout/SKILL.md:34-34",
    "craft-experiment-readout/SKILL.md:35-35",
    "craft-experiment-readout/SKILL.md:36-36",
    "craft-experiment-readout/SKILL.md:37-37",
    "craft-experiment-readout/SKILL.md:40-47",
    "craft-experiment-readout/SKILL.md:53-56",
    "discovery-process/SKILL.md:318-333",
    "discovery-process/SKILL.md:347-353",
    "discovery-process/SKILL.md:355-360",
    "discovery-process/examples/sample-lifesciences.md:77-80",
    "discovery-process/examples/sample-lifesciences.md:81-82",
    "discovery-process/examples/sample-lifesciences.md:83-85",
    "discovery-process/examples/sample.md:39-58"
  ],
  "source_fragment_ids": [],
  "status": "candidate-taxonomy",
  "stop_conditions": [
    "Stop on missing required input, authority, data-governance boundary, failed evidence check, or incompatible permission identity."
  ]
}
