{
  "canonical_unit_ids": [
    "ai-product-strategy:unit-036",
    "ai-product-strategy:unit-052",
    "ai-product-strategy:unit-053",
    "ai-product-strategy:unit-058",
    "ai-product-strategy:unit-059"
  ],
  "capability_id": "capability:ai-organizational-adoption-and-leadership",
  "completion_evidence": [
    "All declared outputs exist and their source citations, hashes, or executable checks are recorded."
  ],
  "decision_references": [
    "V2-DEC-001",
    "V2-DEC-006"
  ],
  "fusion_decision_ids": [
    "V2-FUSION-0006"
  ],
  "hard_gates": [
    "Align product leadership, sponsors, pilot teams, adoption paths, and measurable organizational value for AI work.",
    "Accept only: An AI initiative, organizational constraints, leadership questions, pilot candidates, and value hypotheses.",
    "Produce only: An adoption plan, leadership decision material, pilot evidence, and ownership model.",
    "Preserve explicit source variants and gaps; never upgrade a missing dimension or source preference into a universal rule."
  ],
  "inputs": [
    "An AI initiative, organizational constraints, leadership questions, pilot candidates, and value hypotheses."
  ],
  "lifecycle_stage_id": "stage:03-strategy-prioritization",
  "name": "Ai Organizational Adoption And Leadership",
  "non_responsibility": "Does not approve upstream product decisions, expand authority, or perform remote writes beyond its explicit permission identity.",
  "outputs": [
    "An adoption plan, leadership decision material, pilot evidence, and ownership model."
  ],
  "owning_phase": 7,
  "permission_identity": "workspace-write",
  "primary_domain_id": "domain:learning-retrospective-and-governance",
  "provider_or_framework_variants": [],
  "responsibility": "Align product leadership, sponsors, pilot teams, adoption paths, and measurable organizational value for AI work.",
  "retained_auxiliary_unit_ids": [],
  "root_derived_atom_ids": [],
  "schema_version": "2.0",
  "source_cluster_ids": [
    "cluster:ai-organizational-adoption-and-leadership"
  ],
  "source_defect_refs": [],
  "source_evidence": [
    "ai-product-strategy/references/artifacts.md:177-180",
    "ai-product-strategy/references/artifacts.md:308-313",
    "ai-product-strategy/references/guest-insights.md:800-807",
    "ai-product-strategy/references/guest-insights.md:848-855"
  ],
  "source_fragment_ids": [],
  "status": "candidate-taxonomy",
  "stop_conditions": [
    "Stop on missing required input, authority, data-governance boundary, failed evidence check, or incompatible permission identity."
  ]
}
