{
  "canonical_unit_ids": [
    "design-taste-frontend:unit-002",
    "design-taste-frontend:unit-003",
    "frontend-design:unit-002",
    "frontend-design:unit-003",
    "frontend-design:unit-012",
    "impeccable:unit-005",
    "impeccable:unit-006",
    "impeccable:unit-012",
    "impeccable:unit-013",
    "prototype:unit-004",
    "prototype:unit-005",
    "ui-ux-pro-max:unit-007"
  ],
  "capability_id": "capability:design-context-and-direction-contract",
  "completion_evidence": [
    "All declared outputs exist and their source citations, hashes, or executable checks are recorded."
  ],
  "decision_references": [
    "V2-DEC-001",
    "V2-DEC-002",
    "V2-DEC-006"
  ],
  "fusion_decision_ids": [
    "V2-FUSION-0028",
    "V2-FUSION-0447",
    "V2-FUSION-0448",
    "V2-FUSION-0449",
    "V2-FUSION-0451",
    "V2-FUSION-0452",
    "V2-FUSION-0473"
  ],
  "hard_gates": [
    "Read product and visual authority and define the audience, surface mode, direction, and design contract.",
    "Accept only: Product facts, a brief, design assets, tokens, components, surface context, and references.",
    "Produce only: A design read, selected direction, constraints, spatial thesis, and auditable direction contract.",
    "Preserve explicit source variants and gaps; never upgrade a missing dimension or source preference into a universal rule.",
    "Treat typography, color, card, eyebrow, theme, motion, and other aesthetic prescriptions as context-selected variants. Only accessibility, safety, and performance constraints may be global hard rules."
  ],
  "inputs": [
    "Product facts, a brief, design assets, tokens, components, surface context, and references."
  ],
  "lifecycle_stage_id": "stage:05-experience-design",
  "name": "Design Context And Direction Contract",
  "non_responsibility": "Does not approve upstream product decisions, expand authority, or perform remote writes beyond its explicit permission identity.",
  "outputs": [
    "A design read, selected direction, constraints, spatial thesis, and auditable direction contract."
  ],
  "owning_phase": 4,
  "permission_identity": "workspace-write",
  "primary_domain_id": "domain:ux-ui-and-accessibility",
  "provider_or_framework_variants": [],
  "responsibility": "Read product and visual authority and define the audience, surface mode, direction, and design contract.",
  "retained_auxiliary_unit_ids": [
    "impeccable:craft-floor:browser-surfaces",
    "impeccable:craft-floor:copy-naming",
    "impeccable:craft-floor:coverage-all",
    "impeccable:craft-floor:motion-one-moment",
    "impeccable:craft-floor:motion-palette",
    "impeccable:craft-floor:refuse-cards",
    "impeccable:craft-floor:refuse-geometric-masks",
    "impeccable:craft-floor:refuse-glass-decoration",
    "impeccable:craft-floor:refuse-gradient-text",
    "impeccable:craft-floor:refuse-hard-shadow",
    "impeccable:craft-floor:refuse-hero-metric",
    "impeccable:craft-floor:refuse-kicker",
    "impeccable:craft-floor:refuse-light-dark-by-category",
    "impeccable:craft-floor:refuse-mono-costume",
    "impeccable:craft-floor:refuse-sparklines",
    "impeccable:craft-floor:refuse-system-display-face",
    "impeccable:craft-floor:type-measure",
    "impeccable:craft-floor:verify-contrast",
    "impeccable:craft-floor:verify-depth"
  ],
  "root_derived_atom_ids": [
    "v2-root:gstack/design-consultation:001:root-responsibility",
    "v2-root:gstack/design-consultation:006:phase-0-pre-checks",
    "v2-root:gstack/design-consultation:007:design-setup-run-this-check-before-any-design-mockup-command",
    "v2-root:gstack/design-consultation:009:phase-1-product-context",
    "v2-root:gstack/design-consultation:010:phase-2-research-only-if-user-said-yes",
    "v2-root:gstack/design-review:012:design-setup-run-this-check-before-any-design-mockup-command"
  ],
  "schema_version": "2.0",
  "source_cluster_ids": [
    "cluster:design-context-and-direction-contract"
  ],
  "source_defect_refs": [],
  "source_evidence": [
    "design-taste-frontend/SKILL.md:13-41",
    "design-taste-frontend/SKILL.md:43-80",
    "frontend-design/SKILL.md:11-14",
    "frontend-design/SKILL.md:15-18",
    "frontend-design/SKILL.md:57-60",
    "gstack/design-consultation/SKILL.md:461-494",
    "gstack/design-consultation/SKILL.md:5-9",
    "gstack/design-consultation/SKILL.md:580-619",
    "gstack/design-consultation/SKILL.md:672-711",
    "gstack/design-consultation/SKILL.md:772-811",
    "gstack/design-review/SKILL.md:749-788",
    "impeccable/SKILL.md:26-31",
    "impeccable/SKILL.md:32-42",
    "impeccable/reference/craft-floor.md:10-11",
    "impeccable/reference/craft-floor.md:12-13",
    "impeccable/reference/craft-floor.md:13-14",
    "impeccable/reference/craft-floor.md:15-16",
    "impeccable/reference/craft-floor.md:16-17",
    "impeccable/reference/craft-floor.md:17-18",
    "impeccable/reference/craft-floor.md:23-26",
    "impeccable/reference/craft-floor.md:26-27",
    "impeccable/reference/craft-floor.md:27-28",
    "impeccable/reference/craft-floor.md:33-34",
    "impeccable/reference/craft-floor.md:34-35",
    "impeccable/reference/craft-floor.md:36-37",
    "impeccable/reference/craft-floor.md:37-38",
    "impeccable/reference/craft-floor.md:38-39",
    "impeccable/reference/craft-floor.md:39-40",
    "impeccable/reference/craft-floor.md:41-42",
    "impeccable/reference/craft-floor.md:42-43",
    "impeccable/reference/craft-floor.md:9-10",
    "impeccable/reference/new-work.md:1-15",
    "impeccable/reference/new-work.md:70-86",
    "prototype/SKILL.md:25-30",
    "prototype/SKILL.md:31-41",
    "ui-ux-pro-max/SKILL.md:111-133"
  ],
  "source_fragment_ids": [],
  "status": "candidate-taxonomy",
  "stop_conditions": [
    "Stop on missing required input, authority, data-governance boundary, failed evidence check, or incompatible permission identity."
  ]
}
