{
  "canonical_unit_ids": [
    "improve-codebase-architecture:unit-001",
    "improve-codebase-architecture:unit-002",
    "improve-codebase-architecture:unit-003"
  ],
  "capability_id": "capability:architecture-deepening-discovery",
  "completion_evidence": [
    "All declared outputs exist and their source citations, hashes, or executable checks are recorded."
  ],
  "decision_references": [
    "V2-DEC-001",
    "V2-DEC-006"
  ],
  "fusion_decision_ids": [
    "V2-FUSION-0011"
  ],
  "hard_gates": [
    "Find shallow modules, leaked boundaries, repeated orchestration, and other evidence-backed deepening candidates.",
    "Accept only: A codebase, change hotspots, repeated logic, and maintenance-friction evidence.",
    "Produce only: Scoped architectural candidates, evidence, and a YAGNI-aware recommendation to deepen or leave unchanged.",
    "Preserve explicit source variants and gaps; never upgrade a missing dimension or source preference into a universal rule."
  ],
  "inputs": [
    "A codebase, change hotspots, repeated logic, and maintenance-friction evidence."
  ],
  "lifecycle_stage_id": "stage:06-architecture-risk-security",
  "name": "Architecture Deepening Discovery",
  "non_responsibility": "Does not approve upstream product decisions, expand authority, or perform remote writes beyond its explicit permission identity.",
  "outputs": [
    "Scoped architectural candidates, evidence, and a YAGNI-aware recommendation to deepen or leave unchanged."
  ],
  "owning_phase": 5,
  "permission_identity": "workspace-write",
  "primary_domain_id": "domain:architecture-data-api-and-security",
  "provider_or_framework_variants": [],
  "responsibility": "Find shallow modules, leaked boundaries, repeated orchestration, and other evidence-backed deepening candidates.",
  "retained_auxiliary_unit_ids": [],
  "root_derived_atom_ids": [],
  "schema_version": "2.0",
  "source_cluster_ids": [
    "cluster:architecture-deepening-discovery"
  ],
  "source_defect_refs": [],
  "source_evidence": [
    "improve-codebase-architecture/SKILL.md:1-15",
    "improve-codebase-architecture/SKILL.md:17-26",
    "improve-codebase-architecture/SKILL.md:27-36"
  ],
  "source_fragment_ids": [],
  "status": "candidate-taxonomy",
  "stop_conditions": [
    "Stop on missing required input, authority, data-governance boundary, failed evidence check, or incompatible permission identity."
  ]
}
