{
  "canonical_unit_ids": [],
  "capability_id": "capability:plan-review-decision-synthesis",
  "completion_evidence": [
    "Source-derived atoms and provider or framework variants are cited; required checks and authorization evidence are recorded."
  ],
  "decision_references": [
    "V2-DEC-001",
    "V2-DEC-006"
  ],
  "fusion_decision_ids": [
    "V2-FUSION-0342",
    "V2-FUSION-0343",
    "V2-FUSION-0359",
    "V2-FUSION-0362"
  ],
  "hard_gates": [
    "Fail closed on missing authority, credentials, source evidence, required data governance, or verification."
  ],
  "inputs": [
    "Independent review findings, plan version, decision policy, authority, and unresolved questions."
  ],
  "lifecycle_stage_id": "stage:04-requirements-planning",
  "name": "Plan Review Decision Synthesis",
  "non_responsibility": "Does not absorb unrelated lifecycle responsibilities or expand provider, workspace, or remote-write authority implicitly.",
  "outputs": [
    "Decision matrix, preserved dissent, proposed plan amendments, and explicit human decisions required."
  ],
  "owning_phase": 3,
  "permission_identity": "workspace-write",
  "primary_domain_id": "domain:requirements-and-planning",
  "provider_or_framework_variants": [],
  "responsibility": "Synthesize independent plan-review findings, preserve disagreements, classify reversible versus taste decisions, and surface human approval points.",
  "retained_auxiliary_unit_ids": [],
  "root_derived_atom_ids": [
    "v2-root:gstack/autoplan:008:the-6-decision-principles",
    "v2-root:gstack/autoplan:009:decision-classification",
    "v2-root:gstack/autoplan:025:decision-audit-trail",
    "v2-root:gstack/autoplan:028:phase-4-final-approval-gate"
  ],
  "schema_version": "2.0",
  "source_cluster_ids": [],
  "source_defect_refs": [],
  "source_evidence": [
    "gstack/autoplan/SKILL.md:570-587",
    "gstack/autoplan/SKILL.md:588-623",
    "gstack/autoplan/SKILL.md:871-876",
    "gstack/autoplan/SKILL.md:944-953"
  ],
  "source_fragment_ids": [],
  "status": "candidate-taxonomy",
  "stop_conditions": [
    "Stop before destructive, external-write, merge, deploy, or production action without current explicit authorization."
  ]
}
