{
  "canonical_unit_ids": [],
  "capability_id": "capability:developer-experience-plan-review",
  "completion_evidence": [
    "Source-derived atoms and provider or framework variants are cited; required checks and authorization evidence are recorded."
  ],
  "decision_references": [
    "V2-DEC-001",
    "V2-DEC-006"
  ],
  "fusion_decision_ids": [
    "V2-FUSION-0357",
    "V2-FUSION-0762",
    "V2-FUSION-0763",
    "V2-FUSION-0764",
    "V2-FUSION-0765",
    "V2-FUSION-0766",
    "V2-FUSION-0767",
    "V2-FUSION-0768",
    "V2-FUSION-0769"
  ],
  "hard_gates": [
    "Fail closed on missing authority, credentials, source evidence, required data governance, or verification."
  ],
  "inputs": [
    "Plan, approved product scope, current developer journey evidence, constraints, and decision owners."
  ],
  "lifecycle_stage_id": "stage:04-requirements-planning",
  "name": "Developer Experience Plan Review",
  "non_responsibility": "Does not absorb unrelated lifecycle responsibilities or expand provider, workspace, or remote-write authority implicitly.",
  "outputs": [
    "DX plan review, applicability decision, challenged assumptions, scored gaps, and recommended amendments."
  ],
  "owning_phase": 3,
  "permission_identity": "read-only",
  "primary_domain_id": "domain:requirements-and-planning",
  "provider_or_framework_variants": [],
  "responsibility": "Review a plan for developer-facing setup, API, CLI, SDK, documentation, upgrade, and feedback-loop quality without implementing fixes.",
  "retained_auxiliary_unit_ids": [],
  "root_derived_atom_ids": [
    "v2-root:gstack/autoplan:023:phase-2-5-dx-review-conditional-skip-if-no-developer-facing-scope",
    "v2-root:gstack/plan-devex-review:001:root-responsibility",
    "v2-root:gstack/plan-devex-review:007:plan-devex-review-developer-experience-plan-review",
    "v2-root:gstack/plan-devex-review:009:pre-review-system-audit-before-step-0",
    "v2-root:gstack/plan-devex-review:010:auto-detect-product-type-applicability-gate",
    "v2-root:gstack/plan-devex-review:011:step-0-dx-investigation-before-scoring",
    "v2-root:gstack/plan-devex-review:012:0c-competitive-dx-benchmarking",
    "v2-root:gstack/plan-devex-review:013:0e-mode-selection",
    "v2-root:gstack/plan-devex-review:014:the-0-10-rating-method"
  ],
  "schema_version": "2.0",
  "source_cluster_ids": [],
  "source_defect_refs": [],
  "source_evidence": [
    "gstack/autoplan/SKILL.md:844-863",
    "gstack/plan-devex-review/SKILL.md:1083-1112",
    "gstack/plan-devex-review/SKILL.md:473-512",
    "gstack/plan-devex-review/SKILL.md:5-9",
    "gstack/plan-devex-review/SKILL.md:574-603",
    "gstack/plan-devex-review/SKILL.md:696-719",
    "gstack/plan-devex-review/SKILL.md:796-835",
    "gstack/plan-devex-review/SKILL.md:873-912",
    "gstack/plan-devex-review/SKILL.md:960-991"
  ],
  "source_fragment_ids": [],
  "status": "candidate-taxonomy",
  "stop_conditions": [
    "Stop before destructive, external-write, merge, deploy, or production action without current explicit authorization."
  ]
}
