{
  "canonical_unit_ids": [
    "llm-evaluation:unit-001",
    "llm-evaluation:unit-002",
    "llm-evaluation:unit-003",
    "llm-evaluation:unit-004",
    "llm-evaluation:unit-005",
    "llm-evaluation:unit-006",
    "llm-evaluation:unit-007",
    "llm-evaluation:unit-008",
    "llm-evaluation:unit-009",
    "llm-evaluation:unit-010"
  ],
  "capability_id": "capability:llm-quality-evaluation",
  "completion_evidence": [
    "All declared outputs exist and their source citations, hashes, or executable checks are recorded."
  ],
  "decision_references": [
    "V2-DEC-001",
    "V2-DEC-004",
    "V2-DEC-006"
  ],
  "fusion_decision_ids": [
    "V2-FUSION-0049"
  ],
  "hard_gates": [
    "Evaluate language models with automated metrics, factuality checks, judges, human agreement, statistics, and regressions.",
    "Accept only: Model outputs, references, criteria, annotations, and trusted historical baselines.",
    "Produce only: Repeatable scores, grounded quality judgments, statistical confidence, benchmarks, and regression signals.",
    "Preserve explicit source variants and gaps; never upgrade a missing dimension or source preference into a universal rule.",
    "Before processing customer, proprietary, recorded, or externally judged data, require authorization, minimization, redaction, retention, external-transfer boundary, and deletion policy; otherwise return needs-input or blocked."
  ],
  "inputs": [
    "Model outputs, references, criteria, annotations, and trusted historical baselines."
  ],
  "lifecycle_stage_id": "stage:08-verification-quality",
  "name": "Llm Quality Evaluation",
  "non_responsibility": "Does not approve upstream product decisions, expand authority, or perform remote writes beyond its explicit permission identity.",
  "outputs": [
    "Repeatable scores, grounded quality judgments, statistical confidence, benchmarks, and regression signals."
  ],
  "owning_phase": 6,
  "permission_identity": "local-exec",
  "primary_domain_id": "domain:testing-and-quality-assurance",
  "provider_or_framework_variants": [],
  "responsibility": "Evaluate language models with automated metrics, factuality checks, judges, human agreement, statistics, and regressions.",
  "retained_auxiliary_unit_ids": [],
  "root_derived_atom_ids": [],
  "schema_version": "2.0",
  "source_cluster_ids": [
    "cluster:llm-quality-evaluation"
  ],
  "source_defect_refs": [],
  "source_evidence": [
    "llm-evaluation/SKILL.md:20-71",
    "llm-evaluation/SKILL.md:74-140",
    "llm-evaluation/references/details.md:109-154",
    "llm-evaluation/references/details.md:158-199",
    "llm-evaluation/references/details.md:251-320",
    "llm-evaluation/references/details.md:326-381",
    "llm-evaluation/references/details.md:387-433",
    "llm-evaluation/references/details.md:479-527",
    "llm-evaluation/references/details.md:5-64",
    "llm-evaluation/references/details.md:68-103"
  ],
  "source_fragment_ids": [],
  "status": "candidate-taxonomy",
  "stop_conditions": [
    "Stop on missing required input, authority, data-governance boundary, failed evidence check, or incompatible permission identity."
  ]
}
